{
  "conventions": {
    "editing": "This file is canonical JSON. After initial creation, mutate it with jq (or equivalent structure-preserving tooling), not a text editor. Canonical form: `jq -S .` with 2-space indent; re-running that command must be a no-op.",
    "ids": "Items are T-NNN, zero-padded, append-only. Never renumber, never reuse. Dropped items keep their ID with status=dropped and a note.",
    "ordering": "phase (A/B/C/D) is the coarse logical order; order is the sequence within a phase. Both are proposals to be re-sorted by the repo owner, not commitments.",
    "purpose": "Cross-session idea ledger. Captures decisions and suggestions from design discussions so they survive context loss. An item here is preserved, not necessarily approved.",
    "status_values": [
      "pending",
      "in-progress",
      "done",
      "dropped",
      "deferred"
    ]
  },
  "description": "Todo ledger for k8s-platform-scenarios, seeded from the 2026-07-06 design discussion on scenario storage, deterministic enforcement, docs-blind authoring, and the first experiment.",
  "items": [
    {
      "depends_on": [],
      "id": "T-001",
      "order": 1,
      "phase": "A",
      "status": "done",
      "summary": "Create this TODO.json ledger capturing all suggestions from the founding design discussion, with phases, dependencies, and handoff-quality summaries. Done when merged to main.",
      "tags": [
        "process"
      ],
      "title": "Bootstrap the cross-session todo ledger"
    },
    {
      "depends_on": [],
      "id": "T-002",
      "order": 2,
      "phase": "A",
      "status": "done",
      "summary": "PreToolUse hook (repo .claude/settings.json + scripts/hooks/) that deterministically DENIES WebFetch/WebSearch/Bash calls targeting the platform source (github.com/lago-morph/k8s-platform, raw.githubusercontent.com/lago-morph/k8s-platform, codeload equivalents, git clone/fetch of that repo) while allowing the published docs site (lago-morph.github.io/k8s-platform). This is the docs-blindness contract as enforcement instead of prose. Must land BEFORE any docs-only authoring subagent runs, so isolation is enforced, not promised. Hooks apply to subagent tool calls in-session. Delivered: scripts/hooks/deny-platform-source wired via .claude/settings.json with matcher WebFetch|WebSearch|Bash|mcp__github.*|mcp__Claude_Code_Remote.* — scans tool input for references to the platform source repository (owner/repo path deliberately not written out here, because the hook also scans Bash command text and this summary is passed through one), covering https/ssh/raw/codeload/api URL forms and github-MCP owner+repo params case-insensitively, scrubbing this repository's own -scenarios references first, failing CLOSED on unparseable input. Agent-launch tools deliberately unmatched: probe prompts legitimately contain the forbidden URL as a prohibition, and a subagent's own tool calls are hooked individually. Table-driven tests: scripts/hooks/test-deny-platform-source (19 cases). Verified live: the hook took effect in-session the moment settings.json existed and denied its own author's very next Bash call, whose prose arguments contained the forbidden pattern — enforcement is real and conservative. Network-policy layer remains T-027.",
      "tags": [
        "docs-blindness",
        "enforcement",
        "hook"
      ],
      "title": "Docs-blindness boundary hook"
    },
    {
      "depends_on": [],
      "id": "T-003",
      "order": 3,
      "phase": "A",
      "status": "done",
      "summary": "Create experiments/ directory convention: experiments/NNN-name/ holding loose JSON records from throwaway probes. Deliberately NO schema and NO linting at this stage (records are expected to be discarded); JSON-from-day-one so later hardening has a substrate. Include a small README stating the throwaway expectation. Delivered: experiments/README.md stating the NNN-name convention, the throwaway expectation, and the per-experiment README requirement; scripts/lint-json exempts experiments/ trees to well-formedness-only (no canonical form, no schemas, no semantic checks) per the no-linting decision.",
      "tags": [
        "experiment",
        "storage"
      ],
      "title": "experiments/ storage for throwaway probe records"
    },
    {
      "depends_on": [
        "T-002",
        "T-003",
        "T-006",
        "T-007"
      ],
      "id": "T-004",
      "order": 6,
      "phase": "A",
      "status": "done",
      "summary": "Launch ONE fresh subagent whose only inputs are: the role, the single scenario bullet, the docs site root URL, and a loose output shape. It attempts a full L1 scenario write (actor, preconditions, prose steps with citations, observable outcome, defect classes) and must record every fact it needed but could not find in the docs, every assumption it was forced to make, and where it blocked. Scenario: S4 (tenant-dev deploys a stateless web application from a git repo via GitOps) - confirmed by the owner 2026-07-06; it is the best-documented path (the sole tutorial plus a how-to), so gaps found there bound everything else. Owner's prediction to test: 5-10 immediate documentation findings from this single write. Deliberately one scenario only: what we learn feeds the docs-side pull process and will change how we do the rest. Sequencing per owner: the jq/canonical-JSON mechanics (T-006, T-007) are reviewed before this probe runs. Delivered 2026-07-06: probe ran docs-blind behind the T-002 hook (self-test 19/19 at launch); output saved verbatim in experiments/001-s4-depth-probe/probe-output.json (agent final message arrived one byte short of well-formed; the single terminating brace was restored, disclosed in the experiment README). Result: 15 candidate documentation findings (12 missing facts + 1 blocked + 2 platform-fact assumptions) vs the predicted 5-10, on the best-documented path. Sole hard block: tenant verification access (no shipped human kubectl path; access guide is contract-stability). Triage deliberately not started - that is T-005 with the owner.",
      "tags": [
        "docs-blindness",
        "experiment",
        "scenario"
      ],
      "title": "Depth probe: docs-only L1 write of ONE scenario"
    },
    {
      "depends_on": [
        "T-004"
      ],
      "id": "T-005",
      "order": 7,
      "phase": "A",
      "status": "pending",
      "summary": "Read the probe output with the owner; extract candidate documentation findings into loose JSON records (in experiments/, since findings/ schema does not exist yet). Compare count against the 5-10 prediction. These records seed the findings schema design (T-008) with real shapes instead of speculation.",
      "tags": [
        "experiment",
        "findings"
      ],
      "title": "Triage depth-probe output into draft findings"
    },
    {
      "depends_on": [
        "T-007"
      ],
      "id": "T-006",
      "order": 5,
      "phase": "A",
      "status": "done",
      "summary": "Write a Claude Code skill defining how agents access and modify schema'd, linted documents in this repo: mutate JSON only via jq or equivalent (never text-edit), run the local lint steps explicitly before committing (do not wait for CI to find errors), sort sub-elements alphabetically where order is not semantic, store all JSON pretty-printed in the canonical form so diffs are logical and useful. The skill makes the conventions executable knowledge for every future session. Delivered as .claude/skills/canonical-json-editing/SKILL.md with mutation recipes; structural enforcement by hook/CI remains T-013/T-014.",
      "tags": [
        "convention",
        "linting",
        "skill"
      ],
      "title": "Skill: editing schema'd + linted documents"
    },
    {
      "depends_on": [],
      "id": "T-007",
      "order": 4,
      "phase": "A",
      "status": "done",
      "summary": "Define the canonical JSON form (jq -S: sorted keys, 2-space indent, trailing newline) and the deterministic tooling around it: scripts/lint-json (well-formedness, canonical round-trip, JSON Schema validation per schemas/map.json, per-document semantic checks such as referential integrity and array ordering), scripts/jq-edit (the sanctioned mutation path: jq filter, atomic canonical rewrite, lint), and scripts/validate-schema.py (JSON Schema draft 2020-12; requires python3 jsonschema and fails loudly with exit 2 if missing). schemas/todo.schema.json governs TODO.json as the first schema'd document.",
      "tags": [
        "convention",
        "linting"
      ],
      "title": "Canonical JSON formatting rule + linter"
    },
    {
      "depends_on": [
        "T-005"
      ],
      "id": "T-008",
      "order": 1,
      "phase": "B",
      "status": "pending",
      "summary": "JSON Schema for findings plus findings/ directory layout. Fields per the charter: scenario id, what was attempted, what the docs said, what happened, which artifact the defect lives in (documentation/implementation/requirements/scenario/undetermined), evidence, run id; plus lifecycle status. First schema to build because findings exist before mature scenarios do. Schema enforcement is what makes the platform-side pull (T-025) mechanical.",
      "tags": [
        "findings",
        "schema"
      ],
      "title": "Findings schema and storage"
    },
    {
      "depends_on": [
        "T-005"
      ],
      "id": "T-009",
      "order": 2,
      "phase": "B",
      "status": "pending",
      "summary": "JSON Schema for scenario records at L0 and L1, designed so each level's schema strictly extends the previous level's (L2+ schemas added when needed). Includes the status vocabulary as an enum: draft / ready / blocked-on-docs / blocked-on-platform / deferred / retired, machine-countable from the records. Informed by what the depth probe actually produced, not written speculatively.",
      "tags": [
        "scenario",
        "schema"
      ],